Nome Completo;Nome Para Urna;Cargo;Número;Partido;Situação;Coligação
FRANCISCO PEREIRA CASTELO;DOUTOR CASTELO;Vice-Governador;21;PCB;Deferido;PCB
GILBERTO VASCONCELOS DA SILVA;GILBERTO VASCONCELOS;Vice-Governador;16;PSTU;Deferido;PSTU
JOSÉ HENRIQUE OLIVEIRA;HENRIQUE OLIVEIRA;Vice-Governador;90;SD;Deferido;Fazendo Mais Por Nossa Gente
JUNIOR CESAR BRASIL DE MORAES;JUNIOR BRASIL;Vice-Governador;40;PSB;Deferido;PSB
LUIS GUSTAVO FRANK BRAZ;GUSTAVO BRAZ;Vice-Governador;33;PMN;Deferido;PMN
MARIO LUCIO DA SILVA;MARIO LUCIO;Vice-Governador;50;PSOL;Renúncia;PSOL
NELSON GOMES DE MELO JÚNIOR;NELSON JUNIOR;Vice-Governador;50;PSOL;Deferido;PSOL
REBECCA MARTINS GARCIA;REBECCA GARCIA;Vice-Governador;15;PP;Deferido;RENOVAÇÃO E EXPERIÊNCIA
