Nome Completo;Nome Para Urna;Cargo;Número;Partido;Situação;Coligação
JOÃO DE LIMA FILHO;LIMA;Deputado Estadual;13012;PT;Indeferido;PT
JOAO EVANGELISTA MUNIZ;PR. SGT. MUNIZ;Deputado Estadual;27456;PSDC;Deferido;Força Jovem
JOAO FRANCISCO DO NASCIMENTO;J F NASCIEMNTO;Deputado Estadual;70620;PT do B;Deferido;PRA FRENTE MARANHÃO 2
JOÃO FRANCISCO SANTIAGO DOS SANTOS;NILTINHO;Deputado Estadual;31100;PHS;Deferido;VAMOS JUNTOS MARANHÃO
JOAO LUCIANO SILVA SOARES;LUCIANO GENÉSIO;Deputado Estadual;77456;SD;Deferido;MUDANÇA PARA UM NOVO MARANHÃO
JOAO RODRIGUES BITTENCOURT;JOAO RODRIGUES;Deputado Estadual;12233;PDT;Deferido;TODOS PELO MARANHÃO 4
JOAQUIM DE OLIVEIRA MENDONÇA;SARGENTO OLIVEIRA;Deputado Estadual;36300;PTC;Deferido;PTC
JOCENILDO SILVA DE SOUZA;CAPITÃO JOCENILDO;Deputado Estadual;27007;PSDC;Deferido;Força Jovem
JOCIEDSON DE AGUIAR;JOCIEDSON AGUIAR;Deputado Estadual;33033;PMN;Deferido;VAMOS JUNTOS MARANHÃO
JOCILENE ARAUJO MELO;JOSILENE MELO;Deputado Estadual;54432;PPL;Deferido;PPL
JOCINEIDE DA SILVA RIBEIRO;MORENA;Deputado Estadual;17006;PSL;Deferido;PSL
JOEL COSTA CORREIA;TEN COSTA;Deputado Estadual;27027;PSDC;Deferido;Força Jovem
JOILSON CORREA LIMA;JOILSON LIMA;Deputado Estadual;70456;PT do B;Deferido;PRA FRENTE MARANHÃO 2
JORGE LUIZ FREIRE RANGEL;JORGE RANGEL;Deputado Estadual;50137;PSOL;Deferido;PSOL
JOSANE SARA OLIVEIRA ROSA TAVARES;JOSANE TAVARES;Deputado Estadual;36581;PTC;Indeferido;PTC
JOSE ADRIANO CORDEIRO SARNEY;ADRIANO SARNEY;Deputado Estadual;43123;PV;Deferido;PRA FRENTE MARANHÃO 2
JOSÉ ALBERTO MIRANDA DE SOUSA;ALBERTO CAZULO;Deputado Estadual;17456;PSL;Deferido;PSL
JOSÉ ALVES CAVALCANTE;PR.CAVALCANTE;Deputado Estadual;20123;PSC;Deferido;PRA FRENTE MARANHÃO 2
JOSE ANTONIO DA SILVA;ANTONIO NA MORAL;Deputado Estadual;51789;PEN;Deferido;VAMOS JUNTOS MARANHÃO
JOSÉ ARIMATÉA LIMA NETO EVANGELISTA;NETO EVANGELISTA;Deputado Estadual;45678;PSDB;Deferido;TODOS PELO MARANHÃO 4
JOSE BENEDITO MARQUES FILHO;JOSE BENEDITO;Deputado Estadual;54222;PPL;Deferido;PPL
JOSE BENEDITO PINTO;JOTA PINTO;Deputado Estadual;51123;PEN;Deferido;VAMOS JUNTOS MARANHÃO
JOSÉ CARLOS MARTINS DE SOUSA JÚNIOR;CARLOS MARTINS;Deputado Estadual;45333;PSDB;Deferido;TODOS PELO MARANHÃO 4
JOSE CARLOS NOBRE MONTEIRO;CARLINHOS FLORENCIO;Deputado Estadual;31111;PHS;Deferido;VAMOS JUNTOS MARANHÃO
JOSÉ CONCEIÇÃO DA SILVA FILHO;ZE FILHO DA FARINHA;Deputado Estadual;77111;SD;Deferido;MUDANÇA PARA UM NOVO MARANHÃO
JOSE DA LUZ PINTO DOS SANTOS;ZÉ DA LUZ;Deputado Estadual;31213;PHS;Deferido;VAMOS JUNTOS MARANHÃO
JOSÉ DA SILVA CALVET NETO;CALVET NETO;Deputado Estadual;77655;SD;Deferido;MUDANÇA PARA UM NOVO MARANHÃO
JOSÉ DE ALENCAR SANTOS;ALENCARZINHO;Deputado Estadual;22345;PR;Indeferido;PRA FRENTE MARANHÃO 2
JOSÉ DE ARIMATEIA E SILVA;PROF. ARIMATEIA;Deputado Estadual;17727;PSL;Deferido;PSL
JOSÉ DE RIBAMAR ARAUJO SILVA;JOSE DE RIBAMAR;Deputado Estadual;28008;PRTB;Deferido;PRA FRENTE MARANHÃO 2
JOSÉ DE RIBAMAR BAETA BARROSO;RIBAMAR BAÊTA;Deputado Estadual;27555;PSDC;Deferido;Força Jovem
JOSÉ DE RIBAMAR BEZERRA;PARAÍBA;Deputado Estadual;11777;PP;Deferido;MUDANÇA PARA UM NOVO MARANHÃO
JOSE EIDER SANTOS DE SOUSA;ZE EIDER;Deputado Estadual;33456;PMN;Deferido;VAMOS JUNTOS MARANHÃO
JOSE EUZEBIO LACERDA;JOSÉ LACERDA;Deputado Estadual;50300;PSOL;Deferido;PSOL
JOSE FRANKLIN SKEFF SEBA;FRANK SEBA;Deputado Estadual;77333;SD;Indeferido;MUDANÇA PARA UM NOVO MARANHÃO
JOSE HENRIQUE MACIEL SILVEIRA;ZE HENRIQUE;Deputado Estadual;33111;PMN;Deferido;VAMOS JUNTOS MARANHÃO
JOSE HORLANDO RODRIGUES COSTA;ZÉ HORLANDO;Deputado Estadual;31019;PHS;Deferido;VAMOS JUNTOS MARANHÃO
JOSE INACIO SODRE RODRIGUES;ZÉ INACIO;Deputado Estadual;13123;PT;Deferido;PT
JOSÉ JORGE LOBATO;JORGE BLACK;Deputado Estadual;17900;PSL;Aguardando julgamento;PSL
JOSE MAX PEREIRA BARROS;MAX BARROS;Deputado Estadual;15800;PMDB;Deferido;PRA FRENTE MARANHÃO 2
JOSÉ NILTON PINHEIRO CALVET FILHO;CALVET FILHO;Deputado Estadual;23020;PPS;Deferido;MUDANÇA PARA UM NOVO MARANHÃO
JOSÉ PEREIRA BARBOSA;ZÉ JK;Deputado Estadual;21010;PCB;Cancelado;PCB
JOSÉ RAIMUNDO SEREJO DE ALMEIDA;IRMÃO RAIMUNDO;Deputado Estadual;20777;PSC;Deferido;PRA FRENTE MARANHÃO 2
JOSE RAIMUNDO SILVA PEREIRA;ROCASA;Deputado Estadual;54123;PPL;Deferido;PPL
JOSE RIBAMAR DE JESUS PEREIRA;RIBÃO D'OLUDO;Deputado Estadual;17100;PSL;Indeferido;PSL
JOSÉ RIBAMAR PEREIRA;RIBAMAR PEREIRA;Deputado Estadual;11234;PP;Deferido;MUDANÇA PARA UM NOVO MARANHÃO
JOSÉ RIBAMAR RODRIGUES;PELÉ;Deputado Estadual;17123;PSL;Aguardando julgamento;PSL
JOSE RIBAMAR TEIXEIRA LIMA;ZEQUINHA AGRICULTOR;Deputado Estadual;27110;PSDC;Deferido;Força Jovem
JOSE RIBAMAR VIEIRA DE SOUSA;RIBA DA CONSTRUÇÃO CIVIL;Deputado Estadual;50000;PSOL;Deferido;PSOL
JOSÉ ROBERTO BRIGÍDO MARANHÃO;ROBERTO MARANHÃO;Deputado Estadual;11100;PP;Deferido;MUDANÇA PARA UM NOVO MARANHÃO
JOSE ROBERTO COSTA SANTOS;ROBERTO COSTA;Deputado Estadual;15789;PMDB;Deferido;PRA FRENTE MARANHÃO 2
JOSÉ VICENTE PAURA RIBEIRO;ZÉ VICENTE;Deputado Estadual;20111;PSC;Deferido;PRA FRENTE MARANHÃO 2
JOSE VIEIRA LIMA;VIEIRA LIMA;Deputado Estadual;23654;PPS;Deferido;MUDANÇA PARA UM NOVO MARANHÃO
JOSÉ WILLIAN LIMA DE SOUSA;IRMÃO WILLIAN;Deputado Estadual;20223;PSC;Deferido;PRA FRENTE MARANHÃO 2
JOSEANE MATOS COSTA;JOSEANE MATOS;Deputado Estadual;54333;PPL;Deferido;PPL
JOSEILTON MELONIO COSTA;PROF JOSEILTON;Deputado Estadual;50100;PSOL;Deferido;PSOL
JOSELYO DE AGUIAR SOARES;JOSELYO;Deputado Estadual;23023;PPS;Deferido;MUDANÇA PARA UM NOVO MARANHÃO
JOSEMAR EMILIO SILVA PINHEIRO;ADVOGADO JOSEMAR;Deputado Estadual;12678;PDT;Deferido;TODOS PELO MARANHÃO 4
JOSILEIA SANTIAGO;LEIA;Deputado Estadual;54588;PPL;Deferido;PPL
JOSIMAR CUNHA RODRIGUES;JOSIMAR DE MARANHAOZINHO;Deputado Estadual;22000;PR;Deferido;PRA FRENTE MARANHÃO 2
JOUSENIR CASCAES SANTOS SOUZA;JOSI SOUZA;Deputado Estadual;23222;PPS;Deferido;MUDANÇA PARA UM NOVO MARANHÃO
JOVANE MELO AMORIM;JOVANE;Deputado Estadual;23065;PPS;Deferido;MUDANÇA PARA UM NOVO MARANHÃO
JUCILEIDE GASPAR CASTRO GOVEIA;JUCILEIDE;Deputado Estadual;21200;PCB;Deferido;PCB
JULIO CESAR GOMES;CESAR DE IGUAIBA;Deputado Estadual;28007;PRTB;Indeferido;PRA FRENTE MARANHÃO 2
JULIO CÉSAR RÊGO GUTERRES;JULIO GUTERRES;Deputado Estadual;65123;PC do B;Deferido;TODOS PELO MARANHÃO 4
JURANDIR PAIXÃO OLIVEIRA JÚNIOR;JURANDIR OLIVEIRA;Deputado Estadual;17555;PSL;Deferido;PSL
JUSAN EGSON RODRIGUES DE SOUSA;JUSAN EGSON;Deputado Estadual;36200;PTC;Deferido;PTC
JUSCELINO OLIVEIRA E SILVA;JUSCELINO OLIVEIRA;Deputado Estadual;11000;PP;Deferido;MUDANÇA PARA UM NOVO MARANHÃO
JUSSARA RODIGUES CERQUEIRA;JUSSARA CERQUEIRA;Deputado Estadual;28222;PRTB;Indeferido;PRA FRENTE MARANHÃO 2
KATIA MARIA DE ALMEIDA RIBEIRO;KATIA RIBEIRO;Deputado Estadual;16116;PSTU;Deferido;PSTU
KHEITH FERNANDA RODRIGUES DE OLIVEIRA MORAES;FERNANDA MORAES;Deputado Estadual;65999;PC do B;Indeferido;TODOS PELO MARANHÃO 4
KLAUBETH ROMULO ALBINO DE LIMA;ALBINO;Deputado Estadual;23111;PPS;Deferido;MUDANÇA PARA UM NOVO MARANHÃO
KLEBER BASTOS MOTA;KLEBER BASTOS;Deputado Estadual;28421;PRTB;Deferido;PRA FRENTE MARANHÃO 2
KLEBER DE JESUS CASTRO SILVA;KLEBER CASTRO;Deputado Estadual;54789;PPL;Indeferido;PPL
KLEBER RODON CARVALHO BRANCO;KLEBINHO BRANCO;Deputado Estadual;43444;PV;Deferido;PRA FRENTE MARANHÃO 2
LEOARREN TULIO DE SOUSA CUNHA;LEO CUNHA;Deputado Estadual;20020;PSC;Deferido;PRA FRENTE MARANHÃO 2
LEONARDO BRUNO RODRIGUES MAIA;BRUNO MAIA;Deputado Estadual;17444;PSL;Deferido;PSL
LEONIDAS JOSE ANDRADE CARVALHO;LEONIDAS CARVALHO;Deputado Estadual;17009;PSL;Indeferido;PSL
LEONILDO BRITO MARTINS;LEOZÃO;Deputado Estadual;17700;PSL;Indeferido;PSL
LEONIZARD COELHO DOS SANTOS;LÉO COELHO;Deputado Estadual;51151;PEN;Deferido;VAMOS JUNTOS MARANHÃO
LEVI PONTES DE AGUIAR;DR. LEVI PONTES;Deputado Estadual;77123;SD;Deferido;MUDANÇA PARA UM NOVO MARANHÃO
LIDIANE ALVES DA COSTA;LIDIANE ALVES;Deputado Estadual;65012;PC do B;Deferido;TODOS PELO MARANHÃO 4
LIDIANE FARIAS SARAIVA;LIDIA SARAIVA;Deputado Estadual;17457;PSL;Deferido;PSL
LIDIANE IACONIS PACHECO MOURA;LIDIANE IACONIS;Deputado Estadual;12288;PDT;Deferido;TODOS PELO MARANHÃO 4
LIDUINA FRANCISCA TAVARES DE SOUSA LIMA;PROFA LIDUINA TAVARES;Deputado Estadual;14789;PTB;Deferido;PRA FRENTE MARANHÃO 2
LILCIOMAR MARIANO CARNEIRO;LULCIOMAR DA AUTO ESCOLA;Deputado Estadual;50555;PSOL;Deferido;PSOL
LILIANE REGINA SANTOS COSTA;PROFESSORA LILIANE COSTA;Deputado Estadual;13400;PT;Indeferido;PT
LISIANE MÁRCIA ALVES MARTINS;LISIANE MARCIA;Deputado Estadual;36359;PTC;Deferido;PTC
LUCAS VELOSO DOS SANTOS;LUCAS VELOSO;Deputado Estadual;15015;PMDB;Deferido;PRA FRENTE MARANHÃO 2
LUCIANO VIANA;PROF. LUCIANO;Deputado Estadual;36321;PTC;Deferido;PTC
LUCIVANES PEREIRA OLIVEIRA;LUCIVANES PEREIRA;Deputado Estadual;65865;PC do B;Deferido;TODOS PELO MARANHÃO 4
LUIS AUGUSTO GOMES SILVA;LUIS AUGUSTO LUCAS;Deputado Estadual;65974;PC do B;Deferido;TODOS PELO MARANHÃO 4
LUIS CARLOS SENA DE FREITAS;IRMÃO E PROFESSOR LUÍS CARLOS;Deputado Estadual;11789;PP;Deferido;MUDANÇA PARA UM NOVO MARANHÃO
LUIS FERNANDO ARAUJO DA SILVA;FERNANDO SILVA;Deputado Estadual;13610;PT;Deferido;PT
LUIS GONZAGA DA SILVA;LUIS GONZAGA;Deputado Estadual;23333;PPS;Deferido;MUDANÇA PARA UM NOVO MARANHÃO
LUIS GONZAGA DE ARAÚJO NETO;DR. LUIS KARABINA;Deputado Estadual;51051;PEN;Deferido;VAMOS JUNTOS MARANHÃO
LUIZ CARLOS NUNES ROCHA;LUIZ CARLOS;Deputado Estadual;31777;PHS;Deferido;VAMOS JUNTOS MARANHÃO
LUIZ CARLOS SILVA PEREIRA;LUIZ GUERREIRO;Deputado Estadual;12155;PDT;Deferido;TODOS PELO MARANHÃO 4
LUIZ PEDRO DE OLIVEIRA E SILVA;LUIZ PEDRO;Deputado Estadual;65400;PC do B;Deferido;TODOS PELO MARANHÃO 4
LUZINEIDE PEREIRA VERAS;NEIDE VERAS;Deputado Estadual;17852;PSL;Deferido;PSL
MAGNO AUGUSTO BACELAR NUNES;MAGNO BACELAR;Deputado Estadual;43222;PV;Indeferido;PRA FRENTE MARANHÃO 2
MANOEL CÂNDIDO CARVALHAL;MANU CARVALHAL;Deputado Estadual;50111;PSOL;Deferido;PSOL
MANOEL CANDIDO PEREIRA;MANOEL DENTISTA;Deputado Estadual;28555;PRTB;Renúncia;PRA FRENTE MARANHÃO 2
MANOEL DE JESUS NASCIMENTO SANTOS;MANOEL DA POLO;Deputado Estadual;36333;PTC;Deferido;PTC
MANOEL DE JESUS SERRA AGUIAR;MANOEL AGUIAR;Deputado Estadual;65165;PC do B;Deferido;TODOS PELO MARANHÃO 4
MANOEL DE MIRANDA MACHADO;MACHADO NETO;Deputado Estadual;40300;PSB;Deferido;TODOS PELO MARANHÃO 4
MANOEL GOMES DA SILVA;GOMES;Deputado Estadual;22789;PR;Deferido;PRA FRENTE MARANHÃO 2
MANOEL MACIEL DOS SANTOS;MANELÃO;Deputado Estadual;65423;PC do B;Indeferido;TODOS PELO MARANHÃO 4
MANOEL NUNES RIBEIRO FILHO;MANOEL RIBEIRO;Deputado Estadual;14266;PTB;Deferido;PRA FRENTE MARANHÃO 2
MANOEL OLIVEIRA DOS SANTOS;MANOEL OLIVEIRA;Deputado Estadual;17355;PSL;Deferido;PSL
MANOEL SOARES LOPES;MANOEL SOARES;Deputado Estadual;17600;PSL;Deferido;PSL
MARCELO FREIRE CARNEIRO;MARCELO FREIRE;Deputado Estadual;19000;PTN;Deferido;Força Jovem
MARCIO LEO PEDROSA HELAL;MARCIO HELAL;Deputado Estadual;28345;PRTB;Deferido;PRA FRENTE MARANHÃO 2
MARCIO SOUSA SANTOS;MARCIO MANGA;Deputado Estadual;65222;PC do B;Deferido;TODOS PELO MARANHÃO 4
MARCIO WILLIAM COSTA CUTRIM;MARCIO CUTRIM;Deputado Estadual;17017;PSL;Indeferido com recurso;PSL
MARCO AURÉLIO DA SILVA AZEVEDO;PROFESSOR MARCO AURÉLIO;Deputado Estadual;65111;PC do B;Deferido;TODOS PELO MARANHÃO 4
MARCOS ANTONIO DE CARVALHO CALDAS;MARCOS CALDAS;Deputado Estadual;44444;PRP;Deferido;Força Jovem
MARCOS AUGUSTO TAVARES DURANS;MARCOS DURANS;Deputado Estadual;10680;PRB;Deferido;PRB
MARCOS AURELIO SANTOS PEREIRA;PASTOR MARCOS AURELIO;Deputado Estadual;44555;PRP;Indeferido;Força Jovem
MARCOS DANIEL OLIVEIRA DA SILVA;MARCOS DANIEL;Deputado Estadual;70070;PT do B;Deferido;PRA FRENTE MARANHÃO 2
MARCOS LUIS DE SOUSA CORRÊA;MARQUINHOS CORRÊA;Deputado Estadual;65300;PC do B;Indeferido;TODOS PELO MARANHÃO 4
MARCOS ROBERTO DA SILVA ALVES;MARCOS ALVES;Deputado Estadual;28510;PRTB;Deferido;PRA FRENTE MARANHÃO 2
MARENILDES SANTOS BARROS;MARENILDES SANTOS;Deputado Estadual;28765;PRTB;Deferido;PRA FRENTE MARANHÃO 2
MARI SANTA COSTA RIBEIRO;MARI RIBEIRO;Deputado Estadual;10777;PRB;Deferido;PRB
MARIA ALDENIR SENA FIESCA;NICE;Deputado Estadual;27891;PSDC;Deferido;Força Jovem
MARIA AMELIA ATAIDE PINHEIRO;AMÉLIA;Deputado Estadual;45444;PSDB;Deferido;TODOS PELO MARANHÃO 4
MARIA BERNADETE COSTA CAPUCHINHO;BERNADETE CAPUCHINHO;Deputado Estadual;31567;PHS;Deferido;VAMOS JUNTOS MARANHÃO
MARIA CLARA BATA FARIAS;CLARA FARIAS;Deputado Estadual;13222;PT;Deferido;PT
MARIA DA GRAÇA FONSECA PAZ;GRAÇA PAZ;Deputado Estadual;17000;PSL;Deferido;PSL
MARIA DALVA DA SILVA SOUSA;PROFESSORA DALVA;Deputado Estadual;13134;PT;Deferido;PT
MARIA DAS DORES SILVA;DORA;Deputado Estadual;36500;PTC;Indeferido;PTC
MARIA DE JESUS CASTRO REIS;JESUS REIS;Deputado Estadual;27234;PSDC;Aguardando julgamento;Força Jovem
MARIA DE JESUS FERREIRA;JESUS VERDE;Deputado Estadual;10789;PRB;Indeferido;PRB
MARIA DE JESUS PEREIRA CARVALHO;MARIAZINHA;Deputado Estadual;27113;PSDC;Deferido;Força Jovem
MARIA DE LOURDES BEZERRA;PROF. LOURDES;Deputado Estadual;28003;PRTB;Deferido;PRA FRENTE MARANHÃO 2
MARIA DE NAZARE CONCEICAO;NAZARE DA CIDADE OPERARIA;Deputado Estadual;22234;PR;Deferido;PRA FRENTE MARANHÃO 2
MARIA DE RIBAMAR FARIAS;MARIA DA FITA;Deputado Estadual;12012;PDT;Deferido;TODOS PELO MARANHÃO 4
MARIA DE RIBAMAR NASCIMENTO;DONA RIBA DO JARACATY;Deputado Estadual;27230;PSDC;Deferido;Força Jovem
MARIA DO DESTERRO ALVES DOS SANTOS;DESTERRO;Deputado Estadual;16333;PSTU;Deferido;PSTU
MARIA DO ESPIRITO SANTO ALVES DOS SANTOS;DIVINA ALVES;Deputado Estadual;44100;PRP;Deferido;Força Jovem
MARIA DO SOCORRO ALMEIDA WAQUIM;PROFESSORA SOCORRO WAQUIM;Deputado Estadual;15147;PMDB;Deferido;PRA FRENTE MARANHÃO 2
MARIA EURIDES SILVA MELO;MARIA EURIDES;Deputado Estadual;31082;PHS;Indeferido;VAMOS JUNTOS MARANHÃO
MARIA LUCINDA FERREIRA FRANÇA VERAS;LUCINDA FRANÇA;Deputado Estadual;36777;PTC;Deferido;PTC
MARIA RAIMUNDA QUIRINO DE SOUSA;RAIMUNDA QUIRINO;Deputado Estadual;31233;PHS;Indeferido;VAMOS JUNTOS MARANHÃO
MARIA SANTOS;CHIQUINHA;Deputado Estadual;23055;PPS;Deferido;MUDANÇA PARA UM NOVO MARANHÃO
MARILDA FRAZÃO MENZES;MARILDA FRAZÃO;Deputado Estadual;12555;PDT;Indeferido;TODOS PELO MARANHÃO 4
MARILEIDE PAULO DE ALENCAR SANTOS;MARILEIDE;Deputado Estadual;15444;PMDB;Aguardando julgamento;PRA FRENTE MARANHÃO 2
MARILIA LEAL FERREIRA LAGO;MARILIA LAGO;Deputado Estadual;54567;PPL;Indeferido;PPL
MARILMA DE LA-ROCQUE CARDOSO;MARA LA-ROQUE;Deputado Estadual;23000;PPS;Deferido;MUDANÇA PARA UM NOVO MARANHÃO
MARINETE MATOS BARROS;MARINETE MATOS BARROS;Deputado Estadual;15118;PMDB;Aguardando julgamento;PRA FRENTE MARANHÃO 2
MÁRIO ANTONIO FERREIRA SÁ;TONY FERREIRA;Deputado Estadual;17147;PSL;Deferido;PSL
MÁRIO LIMA REIS;MARIO REIS;Deputado Estadual;22111;PR;Deferido;PRA FRENTE MARANHÃO 2
MARTINHA ARCANGELA PEREIRA BARBOSA;MARTINHA;Deputado Estadual;50700;PSOL;Aguardando julgamento;PSOL
MARY LUCE RODRIGUES LOPES;MARY;Deputado Estadual;15110;PMDB;Aguardando julgamento;PRA FRENTE MARANHÃO 2
MARY LUCIA JARDIM CASTRO DOS REIS;JARDIM;Deputado Estadual;15009;PMDB;Aguardando julgamento;PRA FRENTE MARANHÃO 2
MAURO BORGES GOMES;MAURO BORGES;Deputado Estadual;33888;PMN;Deferido;VAMOS JUNTOS MARANHÃO
MAURO GUSTAVO GUIMARAES SERRA;MAURO SERRA;Deputado Estadual;70300;PT do B;Indeferido;PRA FRENTE MARANHÃO 2
MECENO FERREIRA DA SILVA NETO;MECENO NETO;Deputado Estadual;51777;PEN;Deferido;VAMOS JUNTOS MARANHÃO
MELCHIZEDEC OLIVEIRA SANTOS PAIVA;MELK;Deputado Estadual;36135;PTC;Deferido;PTC
MICHEL ANGELO ALVES BAHIA;MICHEL BAHIA;Deputado Estadual;28777;PRTB;Indeferido;PRA FRENTE MARANHÃO 2
MIGUEL DE JESUS COLINS REGO;LOURO DO FRANGO;Deputado Estadual;28001;PRTB;Deferido;PRA FRENTE MARANHÃO 2
MILTON TEIXEIRA SANTOS FILHO;PROF MILTON;Deputado Estadual;50123;PSOL;Deferido;PSOL
MIRLENE FERREIRA DA SILVA;MIRLENE BARROS;Deputado Estadual;27133;PSDC;Aguardando julgamento;Força Jovem
MURILO PEREIRA DA SILVA;MURILO PONTE;Deputado Estadual;11112;PP;Deferido;MUDANÇA PARA UM NOVO MARANHÃO
NATÁLIA MARCIELLE MENDES FONSECA;NATALIA;Deputado Estadual;36361;PTC;Indeferido;PTC
NATALIA TEIXEIRA GONCALVES;NATY;Deputado Estadual;15111;PMDB;Aguardando julgamento;PRA FRENTE MARANHÃO 2
NATANIEL CARDOZO DA COSTA;NATANIEL CARDOZO;Deputado Estadual;27889;PSDC;Deferido;Força Jovem
NAUM ALVES ESTEVES;NAUM ESTEVES;Deputado Estadual;31123;PHS;Deferido;VAMOS JUNTOS MARANHÃO
NECY SOARES DA COSTA;NECY SOARES;Deputado Estadual;27277;PSDC;Aguardando julgamento;Força Jovem
NEUTON MARTINS CORRÊA FILHO;NEUTON CORRÊA;Deputado Estadual;27190;PSDC;Deferido;Força Jovem
NILCELI SILVA EVERTON;NIL;Deputado Estadual;11888;PP;Deferido;MUDANÇA PARA UM NOVO MARANHÃO
NINA CERES COUTO DE MELO;NINA MELO;Deputado Estadual;15222;PMDB;Deferido;PRA FRENTE MARANHÃO 2
ORLANDO BASTOS DE ALMEIDA;ORLANDO ALMEIDA;Deputado Estadual;17200;PSL;Deferido;PSL
ORLANDO MENDES DE OLIVEIRA;PROF. ORLANDO;Deputado Estadual;70234;PT do B;Indeferido;PRA FRENTE MARANHÃO 2
OSMAR WALCACER DE OLIVEIRA FILHO;OSMAR FILHO;Deputado Estadual;16789;PSTU;Indeferido;PSTU
OTHELINO NOVA ALVES NETO;OTHELINO NETO;Deputado Estadual;65065;PC do B;Deferido;TODOS PELO MARANHÃO 4
OZANAN DE CARVALHO SILVA FILHO;JUNIOR DA CAÇAMBA;Deputado Estadual;43789;PV;Deferido;PRA FRENTE MARANHÃO 2
PALOMA KARENNE DO NASCIMENTO SOUSA;PALOMA;Deputado Estadual;36751;PTC;Indeferido;PTC
PATRICIA DA SILVA BARROS;PATRICIA CESAR;Deputado Estadual;20100;PSC;Deferido;PRA FRENTE MARANHÃO 2
PATRICIA FLAVIA BRAGA VIEIRA LINS;PATRICIA VIEIRA;Deputado Estadual;90123;PROS;Deferido;MUDANÇA PARA UM NOVO MARANHÃO
PAULO CESAR COELHO RIBEIRO;PAULINHO;Deputado Estadual;23300;PPS;Deferido;MUDANÇA PARA UM NOVO MARANHÃO
PAULO CESAR DE SOUSA LINS;PAULO DA VASSOURA;Deputado Estadual;44445;PRP;Deferido;Força Jovem
PAULO DA SILVA CARVALHO;PAULO SOCIAL;Deputado Estadual;54234;PPL;Deferido;PPL
PAULO DOS SANTOS LIMA;PAULO LIMA;Deputado Estadual;17717;PSL;Deferido;PSL
PAULO JUNIOR TEIXEIRA GARCIA;PAULO IP CONECT;Deputado Estadual;17400;PSL;Aguardando julgamento;PSL
PAULO LAUNÉ MENDES;PAULINHO LAUNÉ;Deputado Estadual;36666;PTC;Indeferido;PTC
PAULO MARCELO TORRES ARAÚJO;PAULO MARCELO;Deputado Estadual;36363;PTC;Indeferido;PTC
PAULO ROBERTO ALMEIDA NETO;PAULO NETO;Deputado Estadual;27111;PSDC;Deferido;Força Jovem
PAULO ROBERTO FELIPE SILVA;PAULO FELIPE;Deputado Estadual;54999;PPL;Indeferido;PPL
PAULO SERGIO PEREIRA DOS SANTOS;PAULO SERGIO;Deputado Estadual;36951;PTC;Deferido;PTC
PEDRO ALVES PINHO;PROFº ALVES;Deputado Estadual;54154;PPL;Deferido;PPL
PEDRO OLIVEIRA LIMA JUNIOR;PEDRO JUNIOR;Deputado Estadual;54111;PPL;Indeferido;PPL
PRISCILLA DA SILVA GOVEIA;PRISCILLA;Deputado Estadual;17004;PSL;Indeferido;PSL
PRISCYLLA BONIFÁCIO DE OLIVEIRA SÁ;PRISCYLLA SÁ;Deputado Estadual;51800;PEN;Deferido;VAMOS JUNTOS MARANHÃO
PRYSCILA KHRYSTOPHER MELO MOREIRA GONÇALVES;PRYSCILA DAMASCENO;Deputado Estadual;17999;PSL;Deferido;PSL
RAFAEL DE BRITO SOUSA;RAFAEL LEITOA;Deputado Estadual;12300;PDT;Deferido;TODOS PELO MARANHÃO 4
RAFAEL JAIRO VIEGAS CORREA;JAIRO CORREA;Deputado Estadual;17321;PSL;Indeferido com recurso;PSL
RAFAELA CAVALCANTE COELHO;RAFAELA COELHO;Deputado Estadual;50444;PSOL;Aguardando julgamento;PSOL
RAIMUNDA FERREIRA NUNES;SANTOCA;Deputado Estadual;11223;PP;Deferido;MUDANÇA PARA UM NOVO MARANHÃO
RAIMUNDA NONATA AMORIM OLIVEIRA;MARIA DO CAFÉ;Deputado Estadual;31400;PHS;Deferido;VAMOS JUNTOS MARANHÃO
RAIMUNDA SOARES PEDROSA;RAIMUNDA PEDROSA;Deputado Estadual;31753;PHS;Deferido;VAMOS JUNTOS MARANHÃO
RAIMUNDO ALDEMAR SILVA DE OLIVEIRA;DEMAR FIIM;Deputado Estadual;28210;PRTB;Renúncia;PRA FRENTE MARANHÃO 2
RAIMUNDO BENEDITO DUARTE FONSECA;FOSECA BENET;Deputado Estadual;20737;PSC;Deferido;PRA FRENTE MARANHÃO 2
RAIMUNDO DOMINGOS ANDRADE MENDONÇA;RATINHO MENDONÇA;Deputado Estadual;27130;PSDC;Deferido;Força Jovem
RAIMUNDO FELIX PEREIRA;IRMAO FILHO;Deputado Estadual;28017;PRTB;Deferido;PRA FRENTE MARANHÃO 2
RAIMUNDO JORGE BARROS MAIA;JORGE MAIA;Deputado Estadual;27122;PSDC;Deferido;Força Jovem
RAIMUNDO NONATO ALVES PEREIRA;RAIMUNDO LOURO;Deputado Estadual;22222;PR;Indeferido;PRA FRENTE MARANHÃO 2
RAIMUNDO NONATO AMARAL ARAGÃO;NONATO ARAGÃO;Deputado Estadual;36236;PTC;Deferido;PTC
RAIMUNDO NONATO CONCEIÇAO SOUSA;NONATO SOUSA;Deputado Estadual;28999;PRTB;Deferido;PRA FRENTE MARANHÃO 2
RAIMUNDO NONATO DOS SANTOS SOUSA;JUNIOR CODO;Deputado Estadual;54777;PPL;Deferido;PPL
RAIMUNDO NONATO GONÇALVES DA SILVA;ROMA;Deputado Estadual;17777;PSL;Deferido;PSL
RAIMUNDO NONATO MARTINS FONSECA';DR. RAIMUNDO - RAIMUNDÃO;Deputado Estadual;13013;PT;Deferido;PT
RAIMUNDO NONATO MORAES ANDRADE;NONATO MORAES;Deputado Estadual;23777;PPS;Deferido;MUDANÇA PARA UM NOVO MARANHÃO
RAIMUNDO NONATO RODRIGUES GOMES;GADÊLHA;Deputado Estadual;36884;PTC;Indeferido;PTC
RAIMUNDO OLIVEIRA SILVA;RAIMUNDO SILVA;Deputado Estadual;31444;PHS;Deferido;VAMOS JUNTOS MARANHÃO
RAIMUNDO PEREIRA NETO;RAIMUNDO NETO;Deputado Estadual;21580;PCB;Deferido;PCB
RAIMUNDO SOARES CUTRIM;RAIMUNDO CUTRIM;Deputado Estadual;65678;PC do B;Deferido;TODOS PELO MARANHÃO 4
RAISSA BRITO TAVARES;RAISSA MONTENEGRO;Deputado Estadual;77222;SD;Deferido;MUDANÇA PARA UM NOVO MARANHÃO
RAISSA PINHEIRO SILVA;RAISSA PINHEIRO;Deputado Estadual;50200;PSOL;Deferido;PSOL
RAMILDO AIRES DE OLIVEIRA;AUGUSTIN KARRARA;Deputado Estadual;22100;PR;Deferido;PRA FRENTE MARANHÃO 2
REGILDA DOS SANTOS CORREA;REGILDA;Deputado Estadual;55789;PSD;Indeferido;VAMOS JUNTOS MARANHÃO
REGINALDO DA MATA ALMEIDA;REGINALDO DA MATA;Deputado Estadual;11212;PP;Deferido;MUDANÇA PARA UM NOVO MARANHÃO
REGINALDO MAFRA MARQUES;REGINALDO MAFRA;Deputado Estadual;23555;PPS;Indeferido;MUDANÇA PARA UM NOVO MARANHÃO
REGINALDO NASCIMENTO BATISTA;DR. REGINALDO;Deputado Estadual;65800;PC do B;Indeferido;TODOS PELO MARANHÃO 4
REGINALDO TEIXEIRA MUNIZ;SEU REGIS;Deputado Estadual;31369;PHS;Deferido;VAMOS JUNTOS MARANHÃO
REMI ABREU TRINTA;REMI TRINTA;Deputado Estadual;17889;PSL;Renúncia;PSL
RENAN BERGSON CARVALHO SOUSA;ZORRO PUBLICIDADE;Deputado Estadual;77800;SD;Deferido;MUDANÇA PARA UM NOVO MARANHÃO
RICARDO SILVEIRA DE ASSIS;RICARDO LAGO;Deputado Estadual;54555;PPL;Deferido;PPL
RICARDO TADEU RIBEIRO PEARCE;RICARDO RIOS;Deputado Estadual;51222;PEN;Deferido;VAMOS JUNTOS MARANHÃO
RICHARD NIXON MONTEIRO DOS SANTOS;NIXON SANTOS;Deputado Estadual;15611;PMDB;Renúncia;PRA FRENTE MARANHÃO 2
RIGO ALBERTO TELIS DE SOUSA;RIGO TELES;Deputado Estadual;43200;PV;Deferido;PRA FRENTE MARANHÃO 2
RILDO DE OLIVEIRA AMARAL;RILDO AMARAL;Deputado Estadual;77777;SD;Deferido;MUDANÇA PARA UM NOVO MARANHÃO
ROBERTO CAMPOS FILHO;CABO CAMPOS;Deputado Estadual;11190;PP;Deferido;MUDANÇA PARA UM NOVO MARANHÃO
ROBERTO DE MORAES FERREIRA DOS SANTOS NETO;ROBERTO NETO;Deputado Estadual;40444;PSB;Indeferido;TODOS PELO MARANHÃO 4
ROGERIO RODRIGUES LIMA;ROGÉRIO CAFETEIRA;Deputado Estadual;20000;PSC;Deferido;PRA FRENTE MARANHÃO 2
ROMUALDO SANTOS ERICEIRA;ROMUALDO DAS LOTERIAS;Deputado Estadual;70700;PT do B;Deferido;PRA FRENTE MARANHÃO 2
RONALD HENRIQUE GOMES CHAVES;RONALD CHAVES;Deputado Estadual;27888;PSDC;Deferido;Força Jovem
ROOSEVELT MORAIS JUNIOR;ROOSEVELT MORAIS JUNIOR;Deputado Estadual;40400;PSB;Deferido;TODOS PELO MARANHÃO 4
ROSA CAMPOS DE OLIVEIRA;ROSY CAMPOS;Deputado Estadual;65122;PC do B;Deferido;TODOS PELO MARANHÃO 4
ROSA MARIA FERREIRA;ROSA MARIA;Deputado Estadual;27288;PSDC;Aguardando julgamento;Força Jovem
ROSE VANIA PEREIRA DA SILVA;ROSE DA CAMBOA;Deputado Estadual;20765;PSC;Indeferido;PRA FRENTE MARANHÃO 2
ROSIANE VICENTINI DE MORAES;ROSI VICENTINI;Deputado Estadual;40123;PSB;Deferido;TODOS PELO MARANHÃO 4
ROSSANA MAFRA AZEVEDO;PROF. ROSSANA;Deputado Estadual;28800;PRTB;Deferido;PRA FRENTE MARANHÃO 2
ROZIR FERREIRA LIMA BELFORT;ROZIR LIMA;Deputado Estadual;77997;SD;Deferido;MUDANÇA PARA UM NOVO MARANHÃO
SANDRA MARIA RODRIGUES DA SILVA;SANDRA SILVA;Deputado Estadual;23007;PPS;Indeferido;MUDANÇA PARA UM NOVO MARANHÃO
SARA HELEN LIMA MARQUES;SARA HELEN;Deputado Estadual;77996;SD;Indeferido;MUDANÇA PARA UM NOVO MARANHÃO
SAUL SANTOS AZEVEDO;PROFESSOR SAUL;Deputado Estadual;12456;PDT;Indeferido;TODOS PELO MARANHÃO 4
SAYD RODRIGUES ZAIDAN;SAYD ZAIDAN;Deputado Estadual;65444;PC do B;Deferido;TODOS PELO MARANHÃO 4
SEBASTIAO BARBOSA CRUZ;SEBASTIÃO BARBOSA;Deputado Estadual;22333;PR;Deferido;PRA FRENTE MARANHÃO 2
SEBASTIAO FEREIRA DE OLIVEIRA;PASTOR SEBASTIAO FERREIRA;Deputado Estadual;27192;PSDC;Deferido;Força Jovem
SEBASTIÃO MENEZES SILVA;SEBASTIÃO MENEZES;Deputado Estadual;12666;PDT;Indeferido;TODOS PELO MARANHÃO 4
SÉRGIO BARBOSA FROTA;SÉRGIO FROTA;Deputado Estadual;45456;PSDB;Deferido;TODOS PELO MARANHÃO 4
SERGIO MURILO RAMADA;SERGIO RAMADA;Deputado Estadual;54142;PPL;Deferido;PPL
SERGIO RICARDO OLIVEIRA VIEIRA;SERGIO VIEIRA;Deputado Estadual;51000;PEN;Deferido;VAMOS JUNTOS MARANHÃO
SERGIOMAR SANTOS DE ASSIS;SERGIOMAR DE ASSIS;Deputado Estadual;45677;PSDB;Deferido;TODOS PELO MARANHÃO 4
SEVERINO JOSE COELHO NETO;SEVERINO SALES;Deputado Estadual;44000;PRP;Renúncia;Força Jovem
SIDNEY PEREIRA DA SILVA;SIDNEY PEREIRA;Deputado Estadual;27012;PSDC;Deferido;Força Jovem
SIGLIMEIRE RODRIGUES CURVINA;SIGLIMEIRE RODRIGUES;Deputado Estadual;51321;PEN;Deferido;VAMOS JUNTOS MARANHÃO
SILVANO ANTONIO DE ANDRADE;DR SILVANO ANDRADE;Deputado Estadual;40222;PSB;Deferido;TODOS PELO MARANHÃO 4
SILVANO PINHO DE SOUSA;PASTOR SILVANO;Deputado Estadual;27345;PSDC;Indeferido;Força Jovem
SILVIO SILVA SERRA;SILVIO SERRA;Deputado Estadual;27780;PSDC;Deferido;Força Jovem
SIMONE GAURET SERAFIM LIMA LIMEIRA;SIMONE LIMEIRA;Deputado Estadual;65013;PC do B;Deferido;TODOS PELO MARANHÃO 4
SOLINEY DE SOUSA SILVA FILHO;SOLINEY FILHO;Deputado Estadual;28123;PRTB;Renúncia;PRA FRENTE MARANHÃO 2
SONIA MARLY GUIMARAES PEREIRA;SONIA MARLY;Deputado Estadual;43242;PV;Deferido;PRA FRENTE MARANHÃO 2
STENIO DOS SANTOS REZENDE;STENIO REZENDE;Deputado Estadual;28028;PRTB;Deferido;PRA FRENTE MARANHÃO 2
SUELY ALMEIDA MENDES;SUELY;Deputado Estadual;15115;PMDB;Aguardando julgamento;PRA FRENTE MARANHÃO 2
