Nome Completo;Nome Para Urna;Cargo;Número;Partido;Situação;Coligação
AURÉLIO CARLOS MARQUES DE MOURA;AURELIO CARLOS;Vice-Governador;21;PCB;Deferido;Frente Classista e Socialista
CELIA MARIA VILELA TAVARES;CELIA TAVARES;Vice-Governador;13;PT;Indeferido;COM A FORÇA DO POVO CAPIXABA
CÉSAR ROBERTO COLNAGHI;CÉSAR COLNAGO;Vice-Governador;15;PSDB;Deferido;O ESPIRITO SANTO PODE MUITO MAIS
FABRICIO GANDINE AQUINO;FABRÍCIO GANDINI;Vice-Governador;40;PPS;Deferido;PRA FRENTE ESPÍRITO SANTO
WILSON JESUS LUCAS JUNIOR;WILSON JUNIOR;Vice-Governador;50;PSOL;Deferido;PSOL
